ate,Headlines
2021-01-01,"Tales of underage workers in Apple&quot;s supply chain Apple&quot;s secret roadmap Tech we lost in 2020: Farmville, Flash and Segway top list Tesla And Apple Had The Biggest Impact On The Market Apple Stock: Buy, Sell, or Hold After Soaring 81% in 2020? The 22 biggest tech scandals of 2020, from the unprecedented Twitter hack to the makers of &quot;Fortnite&quot; declaring war on Apple The Apple Watch SE was my best purchase in 2020 - here&quot;s why Apple&quot;s most exciting product ever Is Apple&quot;s share price headed up or down in the new year? Tesla says deliveries for its China-made Model Y SUV will begin this month Apple, Best Stock Of 2020, Surges Into New Year 5 &quot;monster&quot; investment themes I&quot;m betting on in 2021 Tesla leads list of 2020&quot;s biggest winners on both S&P 500, Nasdaq 100"
2021-01-02,"Why Apple &quot;iCar&quot; Won&quot;t Be Self-Driving Gene Munster: Apple will be 2021&quot;s top performing FAANG Apple has Won 5 Design Patents presented in photo & line art forms covering the iPad Pro & Magic Keyboard Combination Apple will let Amphetamine app stay in the App Store after wrongly telling developer it violated App Store rules Bold Prediction: General Motors Is the Next Apple Stock for Investors Benzinga&quot;s Final Bulls And Bears Of The Year: Alibaba, Apple, Intel, Tesla And More Benzinga&quot;s Final Bulls And Bears Of The Year: Alibaba, Apple, Intel, Tesla And More MiB: Dave Welling, Mercer Advisors Apple iPhone Christmas Sales Smash Expectations Mirrored Apple (mAAPL) Price Tops $134.19 Why Apple Rose 12.3% in December OnePlus Watch: Specs, Price, Release Date, Leaks, Rumors Confirmed-Here&quot;s Everything You Need to Know About the New Smartwatch!"
2021-01-03,"The best after-Christmas deals you can get right now: Save $450 on a Lenovo Yoga C940 2-in-1, $60 on a Apple Watch Series 6 and more     - CNET World&quot;s 4th Largest Automaker Set To Take Shape Monday How Optimal&quot;s CEO shifted his company and personal priorities -and is now a better leader Leadership at United Way Worldwide consistently ignored allegations of inappropriate behavior, former employees said Will Apple to go to market with &quot;collaborative driving&quot;? Will Tesla, Apple and Amazon Help The QQQ ETF Reach $400 By 2022? Will Tesla, Apple and Amazon Help The QQQ ETF Reach $400 By 2022? Tesla hit half-million car target in 2020 Tesla hit half-million car target in 2020 Apple will keep the Amphetamine app in its store after dispute with developer over whether it promoted drug use Five iOS bugs and annoyances Apple needs to fix in 2021 Talking About Vaccine News, Oil Predictions, and More Bitcoin Just Broke $600 Billion-Will It Soon Eclipse Tesla, Facebook, Google, Microsoft, Amazon And Apple?"
2021-01-04,"How four of this year&quot;s Transformers helped the world&quot;s biggest banks survive -and thrive-in the pandemic Company Close Updates: Apple Inc. stock underperforms Monday when compared to competitors Evercore: Third straight month of 30%+ growth for Apple App Store Apple&quot;s iPhone assembler agrees to help build startup Byton&quot;s electric SUV     - Roadshow There&quot;s a Major Problem with the Quantumscape Bull Thesis Tesla hits record high as annual vehicle deliveries top analysts&quot; estimates Bad Apple day Sand In My Shoes - December Update Dow Jones Tumbles to Start 2021; Apple Called Top FAANG Stock; Coca-Cola Stock Downgraded This Acquisition Could Boost Apple TV+ to the Next Level Red-Hot Tesla Stock Won&quot;t Repeat 2020, But It Doesn&quot;t Need To Apple&quot;s Latest Privacy Move Is a Blow for Facebook, but Not The Trade Desk. Here&quot;s Why. Sony has Reportedly signed a 3-Year Deal with Apple for next-gen &quot;Direct Time-of-Flight&quot; LiDAR scanners for iPhone 13 & beyond Better Buy: Nike vs. Peloton Here&quot;s My Top Stock to Buy in January How to reset an Apple HomePod in 2 different ways 10 Information Technology Stocks With Unusual Options Alerts In Today&quot;s Session Apple Has Purportedly Asked Foxconn To Create Two Foldable iPhone Prototype Shells 4 Ways Warren Buffett Is Preparing for a Market Crash in 2021 Intel Stock Price Could Soar By 20% - Amid Rising Challenges How to charge your AirPods in 2 ways - wirelessly or with a cable Judge rules Corellium iOS research app &quot;fair use&quot; in slap to Apple Lidar Startup Aeva Adds $200 Million to SPAC Deal Buffett&quot;s 1977 Fortune Article On Inflation Yields Clues For Dealing With Our Deflationary Era Facebook: Buy And Hold Forever Apple (AAPL) Removes 46,000 Apps From China App Store The Zacks Analyst Blog Highlights: Amazon, Apple, Google and Spotify Framing 2021: 6 Trendlines That Will Define Payments And The Connected Economy Why Solar Energy Stocks Can Beat the Market Again in 2021 Thinking about trading options or stock in Nio, Pfizer, CleanSpark, Roku, or Apple? Why Apple became a $2 trillion company in 2020, and what could come next The 7 Best Growth Investments of 2020 Fisker Stock Could Stall Out in 2021 Apple supplier Foxconn forges ties with Chinese EV startup Byton Will Streaming Services&quot; Impressive Show Continue in 2021? Apple supplier Foxconn in Chinese EV deal Apple still hasn&quot;t fixed iOS 14 notifications bug for some users Apple tapped to be the top FAANG stock in 2021 Headwinds and High Valuation Should Make You Skittish on Square Stock Retirement Strategy: Start 2021 Off With These Hated Dividend Aristocrats And Kings To Jump-Start Your Income Stream MGG 851: Long Term Storage, Photos, & Cool Stuff Found &quot;Amphetamine&quot; app to stay in Apple App Store after being bizarrely accused of promoting illegal drugs Apple has Reportedly placed a large order for Millimeter Wave Antennas with a new second Supplier in Taiwan for iPhone 13 Discovery Streaming Service Set For Debut Today, Banks On Olympics Broadcast For Subscriber Growth Apple pitched as No. 1 music stock for 2021 Apple Supplier Foxconn Looks To Invest $200M In Chinese EV Startup Byton: Report Latest Pivot Does Little To Bolster Case for IDEX Stock Charging Higher Samsung Picks Early Launch For Flagship Galaxy S Smartphones M1 MacBook vs Chromebook Comparison: You&quot;d be Surprised What Device Did Better in Real-Life Facebook, Amazon, Tesla stocks outperformed NASDAQ in last week of 2020, Apple shares tumbled Best remote learning MacBook for 2021: MacBook Air vs. MacBook Pro     - CNET Be Greedy When Others Are Fearful: Intel 5 Best Laptop Deals January 2021: Macbook Air Alternatives That are Arguably Better Samsung to unveil Galaxy S21 next week Best MacBook Pro alternatives for 2021     - CNET"
2021-01-05,"The Apple Products That Could Be Released In 2021 Apple (AAPL) Outpaces Stock Market Gains: What You Should Know Apple will modify executive bonuses in 2021 based on Values-Driven Leadership 11 Years Of Dividend Growth Investing - A Portfolio Review Tesla Gets Street-High $810 Price Target From Morgan Stanley The Big Trends to Watch in 2021 Apple will modify executive bonuses based on environmental values in 2021 Is Nasdaq 20,000 in the Cards for 2021? Apple patents envision MacBook that wirelessly charges iPhone, iPad and Watch     - CNET Company Close Updates: Apple Inc. stock rises Tuesday, outperforms market Financial Advisory Corp UT ADV Trims Position in Apple Inc. (NASDAQ:AAPL) Apple patents point to using your MacBook to wirelessly charge your iPhone and Apple Watch U.S. Personal computing devices 5-year CAGR strong: DRG report Sundial Stock Has Georgia on Its Mind Feature: Wall Street Raises Apple Targets Ahead of Earnings Feature: Apple&quot;s Earnings Are Coming. Wall Street Is Getting Excited. Apple Inc. (NASDAQ:AAPL) is M&R Capital Management Inc.&quot;s Largest Position Credit Suisse hikes Apple target $14 to $120 Apple Inc. (NASDAQ:AAPL) Stock Position Reduced by First Financial Bank Trust Division Canaccord Genuity raises Apple target $5 to $150 Google&quot;s iOS Apps Haven&quot;t Been Updated in Weeks. Could Apple&quot;s Privacy Labels Be the Reason? Part Of Apple&quot;s Abuse Of The DMCA Against Corellium Thrown Out... But Part Of It Lives On Apple: Ming-Chi Kuo&quot;s AirTag rumor, same as last year&quot;s AirTag rumor Ford Stock Is As Speculative As Any Electric Vehicle Start-Up Apple lands higher estimates at Canaccord due to iPhone 12 strength &quot;Fast Money&quot; Panel&quot;s Top Stock Picks For 2021: Apple, Live Nation And More 10 Information Technology Stocks With Unusual Options Alerts In Today&quot;s Session NexTech AR taps Microsoft veteran Hareesh Achi to head its advertising network; shares debut on NEO exchange Apple: Waning Momentum Meets Extreme Valuation And Slowing EPS Growth Best Apple MacBook deals: Save $60 on new M1 MacBook Pro, more on older models     - CNET 4 Warren Buffett Stocks He Should Sell Apple&quot;s Price Target Raised by Credit Suisse on Demand for iPhone 12 Apple pops on assembler&quot;s boffo December results CEOs of Microsoft, SNAP, NexTech AR Solutions, Magnite and The Trade Desk discuss the power of AR to transform the advertising market 5 Reasons To Buy Apple Stock (APPL) 2021 Warren Buffett&quot;s Berkshire Hathaway likely scored a $50 billion gain on Apple in 2020 Should you invest in Nio, Apple, Ford, American Airlines, or AT&T? Twitter (TWTR) Acquires Social Broadcasting App Breaker Apple Won 51 Patents Today covering Smart Fabrics, a Series of Design Patents covering AirPods, the iPhone Notch GUI & more 7 Music Stocks to Buy in Lieu of Live Shows iPhone 12 vs. Pixel 5: Apple and Google&quot;s 5G flagships compared     - CNET Tim Cook adds prominent Hispanic publisher to Apple&quot;s board Apple&quot;s upcoming iPhone privacy feature exposes Facebook and Snap to most risk compared to their peers, analysts say The AI Portfolio: 99% YoY Profit, Review, And Adjustments Semiconductor Market on Growth Trajectory: 4 Strong Buys What iPhone Supplier Foxconn&quot;s Strong Quarterly Revenue Means For Apple Apple: Autonomous Driving, Services And 5G Could Be The Keys To Replicating The 2010s In The 2020s Apple names Monica Lozano to board NexTech AR taps Microsoft veteran Hareesh Achi to head its advertising network 3 Things to Expect From Apple in 2021 Monica Lozano Joins Apples Board of Directors SensorTower: Apple App Store spending hit $72.3B, up from $55.5B in 2019 The 7 Best Startups You Can Buy on Republic Right Now 10 Biggest Price Target Changes For Tuesday Apple Wins Second Major Blood Pressure Monitoring Patent that&quot;s part of a larger Project E Fund Management Hong Kong Co. Ltd. Acquires New Holdings in Apple Inc. (NASDAQ:AAPL) A Bubble-Blowing, Bull Market, Blow-Off Top Phase - Cody Willard Joins Alpha Trader (Podcast) Will Contactless Payments be Able to Maintain Their Popularity? Google Still Looks Attractive Given an Expected Rise in Ad Sales Apple has been Granted a Pair of 2-Way Charging Patents for a Future MacBook Pro that could Recharge iDevices and more Hundreds of startups go public every year. Only 20 have ever been founded and led by women. 3 Top Stocks to Recession-Proof Your Portfolio 54% of Part-Time Workers Think Retirement Is Unrealistic for Them -- and They May Be Right 7 Top Communications Stocks Keeping Us Connected in Our Digitalized Lives Rumor Claims that Apple will adopt Fast and Power Efficient Chargers in Q4 based on GaN-on-Si Chips by Navitas Semiconductor JPMorgan Chase & Co. Reiterates $150.00 Price Target for Apple (NASDAQ:AAPL) Every Apple Store in the UK closes as new lockdown restrictions hit Apple&quot;s Supplier Hon Hai (Foxconn) Reported Higher-than-Expected Quarterly Revenue thanks to strong iPhone 12 Demand Bitcoin At $30,000: Caveat Emptor - Buyer Beware Merrill Lynch: Apple services grew 18% in Dec. quarter Google&quot;s iOS apps haven&quot;t been updated in weeks. Could Apple&quot;s privacy labels be the reason? CFN Enterprises (OTCMKTS:CNFN) vs. Qiwi (NASDAQ:QIWI) Head-To-Head Contrast A $21Billion Wager on Who Will Build the Apple Car Apple (NASDAQ:AAPL) Downgraded by BidaskClub A $21Billion Wager on Who&quot;ll Build the Apple Car A $21Billion Wager on Who&quot;ll Build the Apple Car Foxconn ramps up EVs push via deal with Chinese start-up Apple Supplier Foxconn Confirms It Will Make Electric Vehicles With Chinese Startup Byton Twitter Acquires Podcast App Breaker To Bolster Voice-Based Social Media Product Apple iPhone supplier Foxconn rallies 4% after it inks Chinese electric carmaker production deal Apple Supplier Foxconn to Help Chinese Startup Produce Its First Electric SUV Apple 2021 Releases: Kuo Predicts AirTags, New Airpods, and AR Glasses to Push Through! With Apple moving to mini-LED displays for MacBook Pro&quot;s, Samsung is preparing to produce 5X OLED Display volume for PC Notebooks"
2021-01-06,"TSX nears record high as cannabis, renewables lifted by blue wave Dow, S&amp;P 500 close higher, but pro-Trump protests weigh on gains Apple Inc. (NASDAQ:AAPL) Shares Purchased by Woodstock Corp Apple Inc. (NASDAQ:AAPL) is Stonebridge Capital Management Inc.&quot;s Largest Position Capital Investment Services of America Inc. Acquires 1,020 Shares of Apple Inc. (NASDAQ:AAPL) How to use your Mac&quot;s special touchpad commands, and edit them if you&quot;re not satisfied Evercore raises Apple price target $10 to $145 Apple boss Tim Cook nets 220m in shares and pay for 2020 Company Close Updates: Apple Inc. stock falls Wednesday, underperforms market Expect a War in the Clouds as Alibaba Pushes Internationally 3 Hydrogen Stocks to Buy Following the Georgia Senate Runoff Trade Alert: This Virtual Reality Platform Will Change Reality 5 Questions Investors Should Ask Themselves in 2021 Apple Fitness+ Vs. Peloton: How Do They Stack Up? Reflections 2020 Four Reasons for Tech Bulls to Start Worrying Apple&quot;s App Store Clocks Holiday Sales of $1.8 Billion Apple says App Store saw record-breaking holiday spending     - CNET It&quot;s Time to Stock Up on Advanced Micro Devices As It Nears $100 Today&quot;s best online deals: Lodge cast iron skillet, Apple Watch, Final Fantasy VII Remake, Our Place pan, and more 10 Information Technology Stocks Showing Unusual Options Activity In Today&quot;s Session Apple rings in the new year by tooting its own horn App makers explore desperate measures to dodge Apple privacy rules Apple CEO Tim Cook Gets Pay Raise Should You Buy Shares of This SPAC Ahead of Its Merger With Lidar Technologist Aeva? How to connect a wireless mouse to your computer in a few simple steps Should you invest in Apple, Blink Charging, Canopy Growth Corp, Wells Fargo, or Microsoft? Google&quot;s worker revolution is a shot that could end the reign of corporate stockholders Apple App Store sales up 27% year-on-year during holiday week 5 of the Best Investments to Start 2021 on a High Note Apple (AAPL) Supplier Murata Expects Spike in 5G Phone Demand Apple touts record App Store holiday sales as tensions with software companies rise Apple Supplier Murata is building out Production of key Multilayer Ceramic Capacitors to Keep Up with demand for 5G iPhones What A Democratic Victory In Georgia&quot;s Runoff Election Means For The Stock Market Could Airbnb Be a Millionaire-Maker Stock? Apple filing details Tim Cook&quot;s pay, private jet expenses and more Netflix&quot;s (NFLX) Bridgerton Hits the Right Chord With Viewers Berkshire Hathaway Q4 2020 Earnings And Book Value Estimates This Stock Market Sector Will Dominate 2021 Stockstowatchtoday Blog: Apple Stock Drops, Wells Fargo Pops Because the Georgia Election Is a Mixed Bag Apple Continued to Dominate the Japanese Market in Q3 and the iPhone 12 is likely to Drive Shipments Higher Opendoor Stock Needs More Time to Prove Its Worth Tim Cook sees big payday as Apple beat financial targets 2020: A Portfolio In Review Nasdaq Led all Exchanges in 2020 Equity Options Trading Big Tech stocks stumble, electric vehicle stocks gain as Georgia election digested Tesla Market Cap Now More Than 30% of Apple&quot;s Is Now The Time To Buy Stock In Apple, GE, Boeing, FuboTV Or Ideanomics? Tim Cook&quot;s 2020 comp was 256 times the median Apple employee&quot;s Apples&quot; Tim Cook Made Over $14 Million Last Year In an effort to get ahead of Apple Watch Health Features, Samsung has patented a Wearable Blood Sugar monitoring device Is Pfizer Stock a Buy? Apple&quot;s New Patents Indicate Macs Will Be Able To Wirelessly Charge iPhones Foxconn stock price surges after cutting a new production deal with Byton Apple is thinking about turning your MacBook into a wireless charger for your iPhone and Apple Watch Apple could cut, or raise, executive bonuses by 10% based on their performance on environmental and social issues in 2021 Buy Micron (MU) Stock at Highs Before Earnings? iPhones could soon be charged by just touching Apple Mac computers, patents suggest 8 Best Entertainment Stocks to Buy on a Changing Media Landscape Apple (NASDAQ:AAPL) Given New $150.00 Price Target at Canaccord Genuity Global Notebook Computer Shipment Expected to Reach 217M Units in 2021 Apple (NASDAQ:AAPL) Given a $132.00 Price Target by Royal Bank of Canada Analysts Banks, industrials lift Dow, S&amp;P 500 on possible Democrat sweep in Georgia Apple will modify executive bonuses based on environmental values in 2021 Apple MacBook Charging Dock Patent for iPhone Spotted! Apple Watch Can Soon Charge on Laptop Wrist Rests and iPad&quot;s Surface! Apple CEO Tim Cook&quot;s Pay Jumped in 2020 as Remote Work Lifted Profit Apple Says Compliance With Company &quot;Values&quot; Will Impact Executive Cash Bonuses Starting 2021 Apple M1 MacBook Pro VS Razer Book 13 Review: Multi-Core Performance, Price, and More Today I learned your Apple Watch can double as a vlogging viewfinder Google to add App Store privacy labels to its iOS apps as soon as this week Apple CEO Tim Cook&quot;s pay soared nearly 30% last year to almost $15 million as the iPhone maker thrived amid the pandemic Former Apple Engineers are building a Laser Technology Startup with the World&quot;s First 4D LiDAR-on-Chip Technology Apple ties exec bonuses to social, environmental values"
2021-01-07,"Apple&quot;s Self-Driving Electric Car Is At Least Half a Decade Away While Apple continues to Hire Tesla Engineers & Executives to their Future Vehicle Project, it&quot;s Johny Srouji&quot;s contribution that&quot;s a Surprise All I Learned In 2020 Was It&quot;s Best Not To Bet Against Tesla Stock Apple&quot;s Self-Driving Car Is At Least 5 Years Away: Report Apple Supplier Lens Technology Linked to Forced Labor Company Close Updates: Apple Inc. stock outperforms competitors on strong trading day Traders propel Dow, Nasdaq to record highs after Biden&quot;s electoral confirmation The S&P 500 In 2021: A Robinhood Stock Strategy To Beat The Market Why CuriosityStream Is the Streaming Stock to Watch of 2021 7 Safe Stocks to Buy to Start Off the Year While CEOs across America decry the rampage in Washington, Jeff Bezos is silent and Elon Musk is posting memes Apple Will Soon Give Back Its Gains In Spite Of M1 Apple said to have picked up ex-Tesla exec for electric car push Ever-Glory Stock Is a Dark Horse in the Multi-Billion-Dollar Chinese Retail Market 2 Cutting-Edge Companies to Watch in 2020 Why Microsoft Stock Bulls Should Remain Positive 10 Best Stocks For 2021: After An Unprecedented Year, What&quot;s Next? Apple&quot;s move into the EV market may not be the threat to Tesla that some believe, Morgan Stanley analysts say Gene Munster: Apple Stocks+ is hiding in plain sight Apple Inc. (NASDAQ:AAPL) Shares Bought by Integer Wealth Advisors Group LLC How to Trade Apple (AAPL) in the First Half of 2021 How to Trade Apple (AAPL) in the First Half of 2021 NIO Stock: The Huge Reason Nio Shares Are Revving Up Today 10 Information Technology Stocks Showing Unusual Options Activity In Today&quot;s Session Nasdaq breaks 13K for the first time as tech surges Can Amazon Take on Spotify With Podcasts? Apple Patent envisions a completely new Virtual Store Experience with Avatar Salespeople that can make Presentations about Products & more 3 Dividend Stocks You Can Safely Hold in 2021 Summit Financial Group Inc. Sells 1,393 Shares of Apple Inc. (NASDAQ:AAPL) Apple (AAPL) Proxy Statement Mentions Antitrust Risks 3 Mega-Cap Stocks To Buy Going Into the Summer of 2021 Elon Musk surpasses Jeff Bezos to become world&quot;s richest person Apple Estimates Continue to Inch Higher, Driven By Strong iPhone 12 Demand Feature: Apple Estimates Continue to Inch Higher, Driven By Strong iPhone 12 Demand TikTok Adds Augmented Reality Feature for Apple iPhone 12 Apple Car not expected to lead to Blackberry-like flameout for Tesla Apple&quot;s Tim Cook: &quot;A sad and shameful chapter&quot; Here&quot;s Why Plug Power, Aurora, Tilray and Marathon Patent Stock Is Moving Why Digital Turbine Stock Gained Another 26% in December The 44mm Apple Watch SE is $40 off at Amazon Star Apple chip architect from Steve Jobs&quot; days makes news Green Dot Corporation (GDOT) Announces Launch of Mobile Bank SYNNEX (SNX) to Report Q4 Earnings: What&quot;s in the Cards? Critical Contrast: On Track Innovations (OTCMKTS:OTIVF) vs. SolarEdge Technologies (NASDAQ:SEDG) Report: Windows share of notebook market fell below 80% for first time Wall Street Breakfast: Chaos In Washington USTR Criticizes India, Italy, Turkey For Digital Service Tax, Holds Off Retaliatory Action Cryptocurrency market is now worth half as much as Apple, after Bitcoin hit a record above $37,000 Elon Musk took a swipe at Facebook after the attack on the Capitol, saying that the riots were the result of a &quot;domino effect&quot; stemming from the social network&quot;s creation Here&quot;s why Apple won&quot;t be &quot;disappointed&quot; by poor iPhone 12 mini sales Apple reveals how much developers have made since the App Store launched in 2008 A Peek Into The Markets: US Stock Futures Gain; Congress Confirms Biden&quot;s Victory Over Trump Apple Recorded $1.8B Sales On App Store Over Holiday Week Apple Recorded $1.8B Sales On App Store Over Holiday Week Banks, Small Caps Power Stock Rally as Tech Drops Apple M1 Vs. Intel Specs, Release Date and More: M1 MacBook Air 3.5X Faster! 10 things in tech you need to know today Canaccord Genuity Increases Apple (NASDAQ:AAPL) Price Target to $150.00 More devices to come with miniLED displays Big Tech CEOs Condemn Capitol Violence, Term It &quot;Shameful,&quot; &quot;Antithesis Of Democracy&quot; Katy Huberty: Why it is &quot;quite likely&quot; Apple does a car Apple CEO Tim Cook says those responsible for Capitol insurrection should be held to account Apple touts US$1.8b in holiday sales at App Store Microsoft wins patent for a Health Related Wearable Device that Gathers Data and Reports the Hemodynamics of a user Apple chief Tim Cook&quot;s bonus soars 40 per cent to $14.65 million"
