ate,Headlines
2021-05-12,"Judge in Epic Games v. Apple Trial appears to be seeking a compromise in Apple Store Rules Want to bet Tim Cook hasn&quot;t his new adman&quot;s book? The &quot;female Steve Jobs&quot;: Theranos founder Elizabeth Holmes faces her moment of reckoning Y-Intercept (Hong Kong) Ltd Buys Apple Inc, Baxter International Inc, VMware Inc, Sells DuPont ... Dow Jones Futures: Market Rally At Key Level As Inflation Fears Intensify Sell-Off; Apple, Microsoft, Tesla Break Support Wall Street ends with broad sell-off on spiking inflation fears Speaker Maker Sonos Swings To Profit, Raises Full-Year Outlook GasBuddy tops Apple App store amid gas shortages from Colonial Pipeline shutdown Apple&quot;s Find My network can be abused to leak secrets to the outside world via passing devices Wall Street Pondering Ugly Outcomes for Sky-High Tech Shares These 10 LinkedIn Learning classes teach the most in-demand skills companies are looking for - and the courses are free until the end of May All Bets Are Off on Where Amazon Stock Goes From Here Apple-Epic Judge Hints at Compromise in Feud Over App Store Wall Street mood turns from bad to worse as Dow swoons to 700 down in final minutes From a yacht so big it has its own support boat to floating helipads and basketball courts, here are the luxury boats owned by some of the wealthiest people in tech Apple&quot;s stock closes below 200-day moving average for the first time in 13 months Apple&quot;s stock closes below 200-day moving average for the first time in 13 months How to find your AirPods when you&quot;ve lost them TRB Advisors LP Buys Union Pacific Corp, Microsoft Corp, Apple Inc, Sells Amazon. ... Ark Investment Management Offers Paradise &quot; for Gamblers Only Noteworthy Wednesday Option Activity: AAPL, ULTA, EGAN Mirrored Apple (mAAPL) Price Tops $125.15 Qorvo: A Chance To Step Into The 5G Market Without Paying Too Much WidePoint (WYY) to Report Q1 Earnings: What&quot;s in Store? Water&quot;s wet, the Pope&quot;s Catholic, and iOS is designed to stop folk switching to Android, Epic trial judge told Dow Jones Dips, Nasdaq Dives; Fed Official Makes Inflation Pledge; Bears Maul Tech Stocks A Look At Augmented Reality (AR) And Virtual Reality (VR) And Some Possible Winners The Margin: GasBuddy jumps to No.1 on Apple, overtakes crypto-focused Coinbase App, as gasoline prices hit $3 for first time in 6 1/2 years The Margin: GasBuddy jumps to No.1 on Apple, overtakes crypto-focused Coinbase App, as gasoline prices hit $3 for first time in 6 1/2 years It's Time to Take Another Bite of Apple Stock The Trial That Could Break Apple&quot;s App Store Hinges on One Important Question Amazon Prevails In $303M Appeals Case Against European Commission Over Tax Evasion 10 Information Technology Stocks With Unusual Options Alerts In Today&quot;s Session The Coin Flip: Bitcoin in the Crypto Market Today Asia Numbers In Focus In Latest Apple Results Amazon wins EU appeal over tax Berman Capital Advisors, LLC Buys Vanguard Large Cap ETF, Apple Inc, Amazon. ... The best smartwatches for every type of user 7 Great Growth Stocks to Consider for Your Short List Procter & Gamble & Harry & Meghan: New Partnership Seeks &quot;More Compassionate Communities&quot; Thinking about trading options or stock in Apple, Freeport-McMoRan, General Electric, AT&T, or American Airlines? Don&quot;t count on an Apple Silicon Mac Pro this WWDC The new 12.9-inch iPad Pro has a display that&quot;s brighter, darker, and smarter - but the upgrade is only worth it for creative professionals Corning (GLW) Boosts iPhone Glass Production with Apple Funds Corning (GLW) Boosts iPhone Glass Production with Apple Funds Realme Founder Plays Down Impact Of India&quot;s Covid-19 Crisis On Budget Smartphone Maker, Saying Demand Could Take Off Once Worst Is Over See Which Of The Latest 13F Filers Holds Apple Stock Market News for May 12, 2021 Short Sellers Have Had Enough of Betting Against Apple, Microsoft The Apple Developer Academy helps Student Coders, Designers and Entrepreneurs Thrive This Market-Beating Auto Stock Just Raised Its Full-Year 2021 Outlook Apple Presses the Point out that the App Store Prevented more than $1.5 Billion in Potential Fraudulent Transactions in 2020 Apple&quot;s health team is losing a key top exec Cramer Gives His Opinion On Broadcom, Chipotle And More Amazon Scores Court Victory in $303 Million EU Tax Case Virtual Reality Stocks: Skip Facebook, Buy This Stock Instead Virtual Reality Stocks: Skip Facebook, Buy This Stock Instead Apple has developed a way to deliver true 3D content on Device Displays without requiring the use of 3D Glasses Lumentum Misses Revenue Forecast, Apple Supplier Issues Soft Guidance Wall Street Breakfast: Is It Transitory? Apple: A small win for Epic Best MacBook Pro alternatives for 2021     - CNET 3 Companies Getting Whacked by the Global Semiconductor Shortage The Apple M1 iPad Pro is fast, and Intel is in trouble Bango and YouGov likely winners from end of third-party cookies, says broker Apple (NASDAQ:AAPL) Price Target Lowered to $144.27 at Fundamental Research Dow Hits $35,000, Crushing the Nasdaq. What Does That Mean for Retirees? 7 ESG Stocks That Could Come Under Fire if the SEC Gets Its Way The TSMC share price is volatile. Is this tech stock a buy? Apple Inc. (NASDAQ:AAPL) Stock Position Raised by Jag Capital Management LLC The Best Warren Buffett Stocks to Buy With $300 Right Now 3 Stocks That Could Be Worth More Than Apple by 2035 Apple Inc. (NASDAQ:AAPL) Shares Sold by Fieldpoint Private Securities LLC TransDigm Group&quot;s Q2 Revenue And Profit Beat Estimates Blink Expands European Footprint With Blue Corner Acquisition Epic Games Squares Off In Court With Apple Over App Store Fees Eagle Capital Management LLC Sells 7,491 Shares of Apple Inc. (NASDAQ:AAPL) Apple Inc. (NASDAQ:AAPL) Shares Purchased by Cribstone Capital Management LLC BBVA USA Bancshares Inc. Trims Stock Position in Apple Inc. (NASDAQ:AAPL) Tradewinds Capital Management LLC Has $6.54 Million Stock Position in Apple Inc. (NASDAQ:AAPL) Apple Inc. (NASDAQ:AAPL) Shares Sold by CENTRAL TRUST Co Is Apple Working On A Nintendo Switch Clone? SafeMoon, Shiba Inu Bring Little-Known Crypto Exchange Ahead Of Tinder On iPhone App Store Chart iPhone 13 rumors: Apple&quot;s camera bump could be getting even bigger in 2021     - CNET Apple Claims Saving its Users From $1.5B App Store Fraud in 2020 Apple iPad Pro M1 2021 Benchmark Results: 50 Percent Faster than Previous Versions of Using Bionic A-Chip Apple prevented 1 million risky or vulnerable apps from entering App Store in 2020 Apple&quot;s formula is showing Apple Faces UK Class Action for App Store Overcharging Mercer Global Advisors Inc  Buys Apple Inc, S&P 500 ETF TRUST ETF, Schwab International ... Epic v. Apple keeps coming back to the gap between ignorance and inconvenience Apple Claims Its App Store Blocked Over $1.5 Billion in Fraudulent Transactions in 2020 Apple Claims Its App Store Blocked Over $1.5 Billion in Fraudulent Transactions in 2020 Which smartphones have the best battery life? Patek Philippe vs Apple Watch Matter, a Smart Home Collective from Amazon, Apple, and Google is Launching Products This Year"
2021-05-13,"Facebook advertisers are getting hit by Apple&quot;s privacy changes : Fisker stock jumps after announcing U.S. EV manufacturing plans with Foxconn Elmwood Wealth Management, Inc. Buys Apple Inc, Vanguard Short-Term Inflation-Protected ... Capital Asset Advisory Services LLC Buys Apple Inc, Amazon. ... Vantis Investment Advisers L.P. Buys Apple Inc, Airbnb Inc, Amazon. ... Dow Jones Futures: Market Rally Gets Win As CDC Lifts Mask Mandate; Apple, Microsoft Hit Resistance As Bitcoin, Tesla, Square Fall; Disney, Coinbase Lead Earnings Movers Guy who said women are &quot;soft, weak, cosseted, naive&quot; lasted about a month at Apple until internal revolt Guy who said women are &quot;soft, weak, cosseted, naive&quot; will have to find another techbro haven after exiting Apple Inverse ETFs to Play the Decline in Tech Sector Golden State Equity Partners Buys Apple Inc, WisdomTree Yield Enhanced U.S. ... WealthStone, Inc. Buys Ncino Inc, The Shyft Group Inc, Truist Financial Corp, Sells Apple Inc, ... Apple holds edge in app store trial despite nagging issues Apple holds edge in app store trial despite nagging issues &quot;Trading Nation&quot; Traders Weigh In On FAANG Stocks Maybe it&quot;s time for a HomePod fire sale, Apple &quot;Fast Money Halftime Report&quot; Picks For May 13 Wall Street finishes higher following better than expected jobs data 2 Growth Tech Stocks to Buy at a Discount Despite Inflation and Volatility National Asset Management, Inc. Buys Apple Inc, iShares Core S&P 500 ETF, Microsoft Corp, ... Banco Bilbao Vizcaya Argentaria, S.a. Buys iShares Core S&P 500 ETF, Apple Inc, Vanguard ... What Lies Ahead for Tech Stocks &amp; ETFs? How to watch UFC 262: Charles Oliveira and Michael Chandler fight for UFC&quot;s lightweight title this Saturday on ESPN+ Apple India logs record quarter: PC, smartphone, iPad biz grows rapidly Where Gene Munster could be wrong about Apple Bessemer Securities Llc Buys Microsoft Corp, Apple Inc, The Cooper Inc, Sells iShares Core ... Apple&quot;s WWDC 2021: How to watch iOS 15, M1, MacOS 12 and everything else on June 7     - CNET Apple iPhone: China Still Not Looking Good In April : As Epic nears conclusion of case, Apple pushes back at experts Covey Capital Advisors, LLC Buys At Home Group Inc, Apple Inc, IAC/InterActiveCorp, Sells ... The Apple and Amazon Side Hustles 3 Stocks to Buy Even While Markets Are Wobbly Thinking about the new iPad Where to Buy Alibaba on Its Earnings Drop Apple&quot;s Post-Earnings Dip: A Great Buying Opportunity Wall Street comfortably higher following better than expected jobs data How Insider VC reporter Candy Cheng lands big startup scoops while juggling life as a toddler mom Should You Buy Google Stock: Evaluating The Company On A Sum Of The Parts Basis Bernstein&quot;s Toni Sacconaghi on challenges Apple could face next year FTSE 100 trimmed its losses as Wall Street sees strong gains after jobless claims Thinking about trading options or stock in Nio, Alibaba, Ford, Apple, or General Electric? 10 Dividend Aristocrat Stocks for Your Reliability Short List Value And Income Investors: Benchmark Your Portfolio With The Dow Not The S&P 500 Dow Update: Dow rallies 487 points on gains for Boeing, Apple Inc. stocks Stocks rise after three days of losses, Bitcoin drops 11% Disney Could Be In Spotlight Today As Entertainment Giant Reports Earnings Apple stock bounces back above the 200-day moving average, like it did 13 months ago Apple stock bounces back above the 200-day moving average, like it did 13 months ago Dow Update: Boeing, Apple Inc. share gains lead Dow&quot;s nearly 275-point jump Ethic Inc. Buys Apple Inc, Microsoft Corp, Amazon. ... Crake Asset Management LLP Buys Amazon.com Inc, Wells Fargo, Apple Inc, Sells Vale SA, Facebook ... Stock Market News for May 13, 2021 Apple needs to show iOS allows competition... while justifying locking it down Amazon&quot;s second-generation earbuds offer more bang for your buck than Apple&quot;s standard AirPods Why Unity Isn&quot;t Worried About Apple&quot;s Ad Tracking Crackdown 10 Dividend Growth Stocks For May 2021 Why Unity Isn&quot;t Worried About Apple&quot;s Ad Tracking Crackdown Here are the other names Jeff Bezos pitched for Alexa, including Samantha and Friday - and Amazon AMD&quot;s Lisa Su Rocked Semiconductor Boy&quot;s Club And Took On Intel Amazon&quot;s Alexa Gets Biggest Auto Rollout in Six-Year Ford Deal The Tesla share price is falling. Should I buy now? Apple is huge In Apple vs Epic Games, battle of the experts gets personal Apple Releases the Trailer for the British Comedy &quot;Trying&quot; Season 2 that is set to begin Next Friday Apple To See Revenue Growth Ahead Of Street Expectations Through 2025, Munster Estimates: What You Need To Know Analysis: In Apple vs Epic Games, battle of the experts gets personal Apple Watch may one day introduce Gesture input that is driven by Machine Learning and Multiple Sensors Warren Buffett And Tim Cook Snub Blockchain As Corporate Giants Embrace Dow Futures Resume Slump as Inflation Sizzles: Musk U-Turn Slams Bitcoin Update: &quot;A-List Tech Portfolio&quot; Performance Slows Due To Higher Interest Rates And Inflation Lenox Wealth Advisors LLC Lowers Stock Position in Apple Inc. (NASDAQ:AAPL) SOA Wealth Advisors LLC. Purchases 1,274 Shares of Apple Inc. (NASDAQ:AAPL) Freed Investment Group Sells 556 Shares of Apple Inc. (NASDAQ:AAPL) Radnor Capital Management LLC Has $4.79 Million Position in Apple Inc. (NASDAQ:AAPL) Cordatus Wealth Management LLC Boosts Stock Holdings in Apple Inc. (NASDAQ:AAPL) Apple Inc. (NASDAQ:AAPL) Shares Sold by Moreno Evelyn V Apple Backtracks and Sends their recent Ad Engineer Hire Mr. Martinez Packing after receiving an angry Employee Petition Apple Fires Recently-Hired Former Facebook Exec Over Discriminatory Comments Against Women, People Of Color Head-To-Head Review: On Track Innovations (OTCMKTS:OTIVF) & Applied Optoelectronics (NASDAQ:AAOI) Apple Parts With Executive Over Comments About Women Korea Unveils $450 Billion Push for Global Chipmaking Crown Covid-19&quot;s resurgence in India is hitting Apple&quot;s manufacturing hard Apple reportedly cuts ties with employee amid uproar over misogynistic writing     - CNET Apple says &quot;Chaos Monkeys&quot; author hired in ads business has left company Asus takes a swing at Apple&quot;s iPhone 12 Mini with Zenfone 8, a compact flagship with big battery J.P. Morgan: Flat China iPhone sales in April indicate further market share gains The Tech Bubble Is Not In QQQ Apple Says Ads Engineer Leaves Company After Comments Draw Fire Apple Says Ads Engineer Leaves Company After Comments Draw Fire Apple employees speak publicly about recent hire who called women in Silicon Valley &quot;soft and weak&quot; and &quot;full of s--t&quot; GasBuddy Tops Apple App Store Amid Gas Shortages From Colonial Pipeline Shutdown In a rare move, Apple Employees circulate a Petition demanding an investigation into the company&quot;s &quot;misogynistic&quot; new hire Jamf Expands Enterprise iOS, Mac Depth with Wandera Acquisition"
2021-05-14,"US stocks surge in recovery; dollar, bond yields dip Fired Engineer Says Apple Was Previously Aware of His Writing Ex-Apple employee claims company fired him and knew about his past comments on women, people of color Dixon Hubard Feinour & Brown Inc Buys Apple Inc, Microsoft Corp, Thermo Fisher Scientific ... Pro: 2 FAANG stocks to buy and 1 to avoid Dow Jones Futures: ASML, Google, Goldman Flash Buy Signals In Tough Market; Why Apple Is A False Leader Forget Bitcoin: This Stock Gives You Exposure to All Cryptos Apple said Roblox developers don&quot;t make games, and now Roblox agrees Canoo: Significant Changes In Business Strategy Change Our View On The Stock Chinese Government&quot;s Hacker Competition Is Being Used To Find Exploits To Wield Against Uighur Citizens Apple Supplier Foxconn Reiterates Aggravating Semiconductor Chip Crisis Warning: Bloomberg Apple Supplier Foxconn Reiterates Aggravating Semiconductor Chip Crisis Warning: Bloomberg Apple confirms space gray Magic Keyboards, Trackpads, and Mice are discontinued Cricut Chirps First-Quarter Beat As Home-Crafting Trend Surges Chip Shortage Hits This Headset Maker&quot;s Revenue Forecast Mather Group, Inc. Buys Apple Inc, Vanguard Intermediate-Term Government Bond ETF, Vanguard ... Apple Music for Android reveals lossless audio could be imminent Seeking Alpha Catalyst Watch US Senators On The Verge Of A $52B Chip Funding Deal Announcement: Reuters Mirrored Apple (mAAPL) Price Tops $127.87 on Major Exchanges Dow Jones Gains As Rally Continues; Google Stock Offers Buy Point; Apple Retakes Key Level Due to High Demand for Apple iPhones, Foxconn&quot;s Q1 Net Profit was a record breaker Apple&quot;s PC Shipment Growth in India for Calendar Q1 2021 was nothing shy of Mind-Boggling Apple v. Epic: Apple is ready to defend itself from anticompetition claims TSMC is considering a 3 nm foundry in Arizona : Apple lawyer pushes back on anticompetition claims ahead of company&quot;s defense next week How to use AirPlay on Apple TV to stream content from your iPhone, iPad, or Mac The 5 best free PDF editors that allow you to edit and save a PDF file H-1B: Google leads tech giants launching salvo in foreign worker court battle H-1B: Google leads tech giants launching salvo in foreign worker court battle Will 2021&quot;s &quot;Digital Acceleration&quot; Bring Back the Once Great IBM? These 5 Tech Stocks Offer Growth at Reasonable Valuations Mark Zuckerberg turns 37 on Friday. Here&quot;s a look into the life, career, and controversies surrounding the billionaire Facebook CEO. Facebook: A Threat To My Bullish Thesis 10 Information Technology Stocks Showing Unusual Options Activity In Today&quot;s Session After Epic v. Apple namecheck, Itch.io runs one-day-only dev-friendly promo Tech Fights Claim That Foreign-Worker Spouses Help Take Jobs Spotify&quot;s Quickly Following in Netflix&quot;s Footsteps Coinbase To Let The Doge In: What Investors Need To Know FBI Has Gained Access To Sci-Hub Founder&quot;s Apple Account, Email Claims Best smartwatch 2021: Apple Watch and more top picks Apple/Google&quot;s COVID apps saved 100,000s of lives in UK Google leads Big Tech fight for spouses of skilled immigrant workers Google leads Big Tech fight for spouses of skilled immigrant workers Better Buy: Tencent vs. Apple Better Buy: Tencent vs. Apple Thinking about trading options or stock in Apple, Carnival Corp, Alibaba, Seagate Technology, or Spirit Airlines? While Hon Hai warns of component shortages tightening this quarter, Apple Supplier TSMC joins the Semiconductors in America Coalition Churchill Capital IV Looks Poised for a Comeback Apple cutting the contract for the iPhone 12 mini has shown to have crushed Pegatron&quot;s Profit in their latest Financial Report Apple&quot;s second-gen Pencil is $20 off at Woot Streaming Services Thrive on Pandemic: 4 Stocks to Watch Rumor points to Apple&quot;s use of a smaller Face ID Optical Beam that supports the many smaller iPhone Notch rumors Stock Market News for May 14, 2021 Apple, Tesla, and Bitcoin Are in a Technical &quot;Excess Phase Top"" Apple supplier Foxconn expects meaningful EV profits by 2023 Alphabet (GOOGL) Boosts Google Pay Reach With New Feature How is Demand for Streaming Aiding the Music Industry? 3 Golden Tips On How To Invest During This Correction The Apple Designer You&quot;ve Never Heard of Is Making Noise What&quot;s Up With Apple: Epic Trial Drags On, New Apple Store in Rome, and More Apple&quot;s Chief Compliance Officer has written to the U.S. Senate Judiciary Committee, refuting Allegations by Spotify & others in Detail Foxconn: diversifying revenues away from Apple is proving costly Apple locked users into its ecosystem. Tesla wants to do the same with its &quot;iPhone on wheels.&quot; Apple locked users into its ecosystem. Tesla wants to do the same with its &quot;iPhone on wheels.&quot; How Tesla borrows from Apple&quot;s &quot;walled garden&quot; playbook and puts customers at its mercy Will Apple&quot;s 5G Modem Development Sink Skyworks Solutions? Will Apple&quot;s 5G Modem Development Sink Skyworks Solutions? Employees Retirement System of Texas Buys Apple Inc, JPMorgan Chase, Accenture PLC, Sells ... A fix is coming for iPhone battery and performance issues Disney (DIS) Q2 Earnings Beat, Coronavirus Hits Top-line Growth PEAR, not Apple, is the code name for Fisker-Foxconn&quot;s U.S.-made electric car Foxconn&quot;s profit climbs as COVID-19 sustains demand A 20-year Apple veteran just unveiled a wild new kind of speaker Apple supplier Foxconn expects meaningful EV profits from by 2023 Should iShares MSCI USA Multifactor ETF (LRGF) Be on Your Investing Radar? Foxconn bounces back from pandemic disruption as profit soars Apple and Microsoft&quot;s Rivalry Had Cooled. Now It&quot;s Back andGetting Testier Apple WWDC 2021: iOS 15, MacOS 12 and everything we expect     - CNET Google leads court filing supporting tens of thousands of U.S. visa-holders&quot; ability to work Apple Inc. (NASDAQ:AAPL) is Cornerstone Wealth Group LLC&quot;s 4th Largest Position RNC Capital Management LLC Lowers Stake in Apple Inc. (NASDAQ:AAPL) Dow Futures Extend Gains As CDC Drops Mask Mandate, Tech Stocks Rebound 10 things in tech you need to know today 20 Years On: The Global Apple Store Empire [Infographic] One Day In July LLC Has $1.06 Million Stock Position in Apple Inc. (NASDAQ:AAPL) Zweig DiMenna Associates LLC Sells 108,387 Shares of Apple Inc. (NASDAQ:AAPL) Martin Pelletier: Where to look for hidden value in a market gone mad Apple Inc. (NASDAQ:AAPL) Position Lowered by Nisa Investment Advisors LLC iPhone 13: Apple fans might not like the sound of the newest design rumor     - CNET IPhone Maker Hon Hai Again Warns Components Crunch Worsening Apple reportedly to sharply cut VCSEL die size for 3D sensors Apple supplier Foxconn reports first quarter profit TUS$28.2 billion, beats estimates Bailard, Inc. Buys Apple Inc, Microsoft Corp, Amazon. ... Axiom Investment Management LLC Buys Danaher Corp, Fortive Corp, Apple Inc, Sells Alphabet Inc, ... Qualcomm Is Not Cheap Enough Foxconn: diversifying revenues away from Apple is proving costly"
2021-05-15,"Crash victim had posted videos riding in Tesla on Autopilot Crash victim had posted videos riding in Tesla on Autopilot Crash victim had posted videos riding in Tesla on Autopilot To Apple&quot;s &quot;woke mobs&quot;: What about Dr. Dre and the Uighurs? ask Matt Taibbi Here Is What You Can Expect At Major US Stores Following CDC&quot;s New Mask Guidance Here Is What You Can Expect At Major US Stores Following CDC&quot;s New Mask Guidance Tech stock drivers: Apple vs. Epic concludes, Palo Alto Networks reports earnings Benzinga&quot;s Bulls And Bears Of The Week: Apple, Coinbase, Disney, Nike, Uber And More Benzinga&quot;s Bulls And Bears Of The Week: Apple, Coinbase, Disney, Nike, Uber And More MiB: Danny Kahneman on Noise This Is the Secret to Beating the Stock Market Apple could deliver a Future iPhone and AR Glasses with Insane Screen Resolutions up to 4,000ppi 3 Growth Stocks I&quot;d Buy Right Now 3 Growth Stocks I&quot;d Buy Right Now Apple: Antonio Garca Martnez strikes back The Author of the Book &quot;Chaos Monkeys&quot; has commented about his very public firing at Apple on Twitter Stocks To Watch: Retail Earnings Rush, Ford&quot;s Electric F-150 And Oatly IPO Mark Zuckerberg&quot;s existential product crisis Tech Stocks Roundup: Jim Cramer Says to Hold Onto FAANG Stocks Why is Microsoft bad-mouthing Apple? A pink iPhone 13? Apple, please make this happen     - CNET The iPhone 13 could get a new battery, cameras and display     - CNET Apple Inc. (NASDAQ:AAPL) Shares Sold by Brickley Wealth Management Cornerstone Investment Partners LLC Sells 12,347 Shares of Apple Inc. (NASDAQ:AAPL) iPhone 13&quot;s juiciest rumors so far: What&quot;s going on with Apple&quot;s notch design?     - CNET How a storyteller helps in creating an entrepreneur&quot;s brand Apple Inc. (NASDAQ:AAPL) is Ferguson Wellman Capital Management Inc.&quot;s 2nd Largest Position Precision Wealth Strategies LLC Raises Position in Apple Inc. (NASDAQ:AAPL) Wait, no AirPods 3? Every Apple product and rumor we&quot;re still waiting on     - CNET 3 AirPods upgrades I want Apple to make this year     - CNET Apple (NASDAQ:AAPL) PT Lowered to $144.27 at Fundamental Research How Apple&quot;s new audio subscriptions are upending podcasting Apple (NASDAQ:AAPL) PT Set at $132.00 by Sanford C. Bernstein AirPods 3 might make an appearance next week. Here&quot;s everything we know     - CNET Apple and Microsoft&quot;s rivalry had cooled. Now it&quot;s back andgetting testier. Apple Space Gray Accessories to Discontinue Production and Distribution After iMac Pro Phase Out-Where to Buy Now Walmart, Costco, Trader Joe&quot;s and Publix no longer require masks for vaccinated customers. See the list. Wedbush Morgan Securities Inc Buys Vanguard S&P 500 ETF, ISHARES TRUST, Apple Inc, Sells ... Apple Patents a Way To Deliver 3D Content Without 3D Glasses From The I-Phone To The I-Car:  Which LiDAR Will Apple Use? Big Tech enters fight over visas to save jobs of foreign-worker spouses Tech manager who called Bay Area women &quot;soft and weak&quot; says Apple fired him Tech manager who called Bay Area women &quot;soft and weak&quot; says Apple fired him &quot;Chaos Monkeys&quot; author calls Apple&quot;s statement on his departure defamatory"
