ate,Headlines
2021-03-30,"Review: EPOS GTW 270 Hybrid is a few steps away from being the ideal gamer earbuds Epic Games files complaint in UK against Apple &quot;Bolt on the rocket boosters&quot;: Energy Systems Catapult calls for sweeping electricity market reform to drive net zero revolution Apple wants to give Tesla ""a run for its money"" The New Foxconn Needs to Step on ItsEV Pedal Android sends 20x more data to Google than iOS sends to Apple, study says Who ya gonna call? Apple expands Independent Repair programme to New Zealand 7 Infrastructure Stocks Ready for the Looming Supercycle What To Know About 20th Television Animation, Disney&quot;s New Adult-Oriented Cartoon Unit Top Stock Reports for Apple, AlibabaAT&T Wall Street ends down after Dow falls 100 points from Monday&quot;s record high Apple iPhone Assembler Warns Of &quot;Materials Shortages&quot; Apple blocked some searches with the word &quot;Asian,&quot; and now it&quot;s getting fixed Chip Supply Shortage Will Last Through 2022: Foxconn Apple Maps will show COVID-19 travel guidances so you know what to expect at the airport Apple ditching ""iPhoto"" The biggest risk for technology stocks is growing tensions between the US and China, Wedbush says WWDC 2021 is scheduled to kick off June 7 Foxconn, Apple&quot;s biggest supplier, is the latest company to be impacted by the global shortage of microchips Arm&quot;s first new architecture in a decade is designed for security and AI Apple Pay becomes South Africa&quot;s second digital wallet Apple won 77 patents today covering the Apple Watch Digital Crown used for ECG, Adjustable Optical Layers for future Eyewear & more Apple App Store Allegedly Allows Scam Apps to Steal Users&quot; Bitcoin- Spotting Fake Applications Apple&quot;s iPhone surpasses Android in sales Even At A $2 Trillion Market Cap, Apple Can Offer Market-Beating Returns Apple to hold WWDC event online again as it prepares for launch of iOS 15 and other updates Koshinski Asset Management, Inc. Buys Apple Inc, AbbVie Inc, Vanguard Dividend Appreciation ... Apple Is A Stock To Hold For A Long Time Portfolio Management: 3 Ways to Avoid Losing Money in the Stock Market : Apple faces new competition complaint from Epic Games in global battle over App Store payments : Apple faces new competition complaint from Epic Games in global battle over App Store payments Apple and Disney Collaborate for Contactless Ticket: How to Use iPhone&quot;s New MagicMobile Pass Xiaomi to invest in smart car business Apple Supplier Foxconn: Chip Supply Shortage Will Hurt Shipments, Last Through 2022 Video: Tuesday&quot;s ETF with Unusual Volume: SPGP Adobe&quot;s new $14.99 iPad subscription bundles Photoshop, Illustrator, Fresco, and more US-China Tension Can Spur India&quot;s Global Tech Hub Aspirations: Bloomberg Apple plans to host all-virtual WWDC event beginning June 7 How to Get the Most Out of Your Quants Video: SPY, WBIY: Big ETF Inflows Barron&quot;s Take: Apple Developers Conference Will Be Online Again Notable ETF Inflow Detected - SPLG, AAPL, MSFT, AMZN Apple will host WWDC entirely online for the second year in a row TikTok owner ByteDance may be worth more than Twitter and Coca-Cola as a public company Why Pinterest Shares May Continue to Sink Thinking about trading options or stock in Apple, Tencent Music Entertainment, Nio, Bank of America, or American Airlines? Epic Games complains about Apple to UK competition watchdog Apple&quot;s WWDC Stays Online-Only, Kicking Off June 7 Why You Need to Own Schlumberger Apple WWDC 2021: iOS 15, iPadOS 15, WatchOS 8, MacOS 12, and tvOS 15 Release Dates Soon Nano Dimension Is an Excellent Play in a Burgeoning 3D Printing Market Apple (AAPL) Expands Apple TV+ Content With Documentaries Apple to host developers event online again as COVID-19 cases surge Xiaomi has just launched a new 3-device wireless charging pad while Apple wins another wireless charging mat patent Apple expected to unveil new iPhone, Mac and Watch software on June 7 in virtual event Apple WWDC 2021 announced as online-only event Welcome to the Apple Developer app Apples Worldwide Developers Conference is Back in its All-Online Format Why Do Baby Boomers Hate Square? Apple Loses Legal Battle Over Swatch: Blocking of Steve Job&quot;s &quot;One More Thing&quot; Failed? 2 Top Growth Stocks to Buy in a Market Crash Here&quot;s why Foxconn stock price is up 40% YTD Apple failed to block a Swiss watchmaker trademarking &quot;one more thing,&quot; a phrase Steve Jobs often used in product reveals Epic Games complains about Apple to UK competition watchdog Apple Inc. (NASDAQ:AAPL) Holdings Cut by Dillon & Associates Inc. Apple supplier Foxconn warns components shortage to last until 2022 Is Now The Time To Buy Stock In Nokia, Nio, Amazon, Peloton, Netflix Or Apple? What&quot;s Up With Apple: iCar Designs, Independent Repair Expansion and More Apple has Won a Patent for the Mac Pro&quot;s 3D Structural Design that could one day extend to a Future iPhone Apple roundup: Foxconn warns of supply shortage, Epic backs UK antitrust probe How to connect two pairs of AirPods to one iPhone, and share music wirelessly with your friends Apple supplier Foxconn says chip shortage will curb shipments Epic Games files complaint against Apple with UK regulator The Zacks Analyst Blog Highlights: Apple, NVIDIA, Micron Technology, Applied Materials and Analog Devices Swatch can trademark Apple&quot;s &quot;One more thing&quot; Foxconn reports a 12% decline in its full-year net profit Bloomberg: Foxconn, anticipating Apple car, disappoints investors He believed Apple&quot;s App Store was safe. Then a fake app stole his life savings in bitcoin. This Apple Chipmaker Is Primed for a Rebound in April Fortnite-maker accuses Apple of &quot;kneecapping the competition&quot; iPhone 6 sales shatter expectations Is iShares MSCI ACWI Low Carbon Target ETF (CRBN) a Strong ETF Right Now? Apple Inc. (NASDAQ:AAPL) is Federated Hermes Inc.&quot;s 10th Largest Position 4 Stocks to Watch as Pandemic Boosts Contactless Payments Apple has Won a Patent for a Reconfigurable Force-Sensitive MacBook 3 Stocks to Watch Amid Rising Demand for Smart Speakers Apple supplier Foxconn&quot;s profit slips, warns on &quot;materials shortages&quot; Apple wins a patent for an improved way of using glove touch mode on an iPhone Highlander Capital Management LLC Has $9.19 Million Position in Apple Inc. (NASDAQ:AAPL) Apple to introduce the industry&quot;s first 4nm processor in a Q4 MacBook with 3nm still on Schedule for the 2022 iPhone &quot;Biggest Risk&quot; Facing Apple, Tesla, Other Nasdaq Stocks? US-China &quot;Cold Tech War,&quot; Says Analyst Apple Customers Will Get Access To Independent Repairs In Most Countries By End Of Year Apple supplier Foxconn&quot;s Q4 profit slips, lags view iPhone Maker Foxconn Q4 Earnings Drop YoY, Miss Street Estimates Wingtech Technology has officially acquired major parts of Apple supplier OFilm and is to supply Apple with camera components Apple supplier Foxconn&quot;s Q4 profit slips, lags view Apple supplier Foxconn&quot;s fourth-quarter profit slips, lags view Apple supplier Foxconn fourth quarter profit misses estimates Sequans Communications (NYSE:SQNS) versus On Track Innovations (OTCMKTS:OTIVF) Critical Analysis Soon, Apple&quot;s Independent Repair Provider Programme will be available to Malaysian repair shops"
2021-03-31,"Apple Pay hackers using stolen credit card data Billed As A Year Of Transition,2021 Has Lived Up To The Hype Apple (AAPL) Outpaces Stock Market Gains: What You Should Know The Return of Strong Earnings Growth Memory-Chip Maker Micron Beats Wall Street&quot;s Q2 Targets, Guides Higher The Ultimate Guide to Investing in Growth Stocks Apple Options Traders See Upside Ahead The Nasdaq Rallied Today. Here&quot;s Why. Tech shares pushes stocks higher; crude falls Apple commits to build ""grid-scale"" energy storage in California Reports of Apple Pay fraud linked to how cards are verified 3 SPACs to Buy Despite the Rough-and-Tumble Market Apple will recalibrate iPhone 11 batteries to fix performance and capacity issues Apple&quot;s Investment, Strategic Partnership In UnitedMasters: What You Need to Know Magna&quot;s CEO made a simple comment about willing to work with Apple on an Electric Car and the stock market reacted immediately Apple&quot;s Siri will stop defaulting to a female voice in the U.S., two new voices coming Apple&quot;s iPad, iPhone Update Removes Controversial Setting: Issue Blocks Websites Mentioning &quot;Asian&quot; Apple won&quot;t give Siri a female-sounding voice by default anymore Apple New Patent: IPhone Design Borrows Mac Pro&quot;s 3D Built--A Glimpse of What&quot;s Inside it UBS upgrades Apple, predicts it will take a big share of the electric vehicle market Alphabet (GOOGL) Introduces Advanced Updates on Google Maps 10 Information Technology Stocks Showing Unusual Options Activity In Today&quot;s Session Apple sidesteps bias debate by leaving Siri&quot;s gender up to you Apple Stock Doesn&quot;t Reflect The Company&quot;s Electric Vehicle Potential, Analyst Says The Wall Street Journal: Apple invests $50 million into music distributor supporting independent artists The International Air Transport Association has announced that a new travel pass app will launch on Apple iPhone in April Wall Street gains ahead of Biden&quot;s spending plan outline Apple to build battery-based solar energy storage project in Monterey County Apple to build battery-based solar energy storage project in Monterey County Apple upgraded to a &quot;buy&quot; rating with 18% upside as UBS says &quot;no super cycle, no problem&quot; Apple Stock Rallies Because UBS Believes in the iCar Apple Announces California Solar Energy Storage Project: Reuters Lennar Corp, Ringcentral, Apple, Amazon and Google highlighted as Zacks Bull and Bear of the Day Will Apple ""spring forward"" with smart watch Disney&quot;s (DIS) New Division to Focus on Adult Animation Apple Stock Upgraded On Apple Car Potential, iPhone Strength You Should Think of Investing in Alphabet Stock as a Perennial Good Buy How to change the refresh rate on your monitor for smoother-looking videos and gameplay Video: Dow Movers: IBM, WBA UBS upgrades Apple from Neutral to Buy, raises target $27 to $142 Benzinga&quot;s Top Ratings Upgrades, Downgrades For March 31, 2021 4 of the Best Stocks You&quot;ve Never Heard of but Should Definitely watch Thinking about trading options or stock in BioNTech, Apple, Moderna, General Motors, or Nio? Apple to build battery-based solar energy storage project in California The Growth Story Is Just Getting Started for Pinterest Stock Apple (AAPL) to Host Virtual WWDC 2021 Between Jun 7 and 11 Is Now The Time To Buy Stock Or Options In GameStop, Apple, Zoom Or Bumble? Google Collects 20 Times More Telemetry From Android Devices Than Apple From iOS Apple Powers Ahead in New Renewable Energy Solutions With Over 110 Suppliers Top Analyst Upgrades and Downgrades: Apple, Applied Materials, BP, Bumble, Carrier, Harley-Davidson, Hess, Illumina, Johnson Controls and More Google Wallet ramping up competition against Apple Pay Silicon Valley is starting to bring workers back to the office Silicon Valley is starting to bring workers back to the office Stock Market News for Mar 31, 2021 Harlem Capital, Rare Black-Led VC Firm, Raises $134 Million Second Fund Dogs Of The Dow For April: Chevron Yield Leads The Pack Apple Inc. (NASDAQ:AAPL) is Alerus Financial NA&quot;s 5th Largest Position What&quot;s Up With Apple: WWDC 2021, New Investment in Music, and More 10 Biggest Price Target Changes For Wednesday Clubhouse App Has People Talking On The Newest Social Media Craze Self-Driving Cars Head Toward Collision With Insurance Status Quo The Zacks Analyst Blog Highlights: Apple, Alibaba Group, AT&amp;T, Intuitive Surgical and Zoetis Apple&quot;s electric car plans are key for big upgrade from UBS Apple&quot;s iPhone update fixes issue that marked &quot;Asian&quot; websites as adult content Business Insider: Apple will never develop a car Will Xiaomi Be the Apple of Electric Vehicles? UnitedMasters, an Independent Music Artist Distribution Platform, has secured a $50 Million &quot;Series B&quot; Investment Led by Apple Apple iPhone 13 Pro Max Kuo Leaks: Powerful Wide Angle Camera with Low Light Photos Revealed 1 FAANG Stock to Buy Right Now and 1 to Avoid Clear Creek Financial Management LLC Makes New Investment in Apple Inc. (NASDAQ:AAPL) BDO Wealth Advisors LLC Acquires 5,784 Shares of Apple Inc. (NASDAQ:AAPL) Those Memoji glasses: A deliberate Apple tease? China mulls new stock exchange and seeks to pull in Tesla, overseas-listed firms - report China mulls new stock exchange and seeks to pull in Tesla, overseas-listed firms - report IATA travel pass app for COVID-19 results, vaccination status to launch on Apple in mid-April 71% of Warren Buffett&quot;s Portfolio Is in These 5 Stocks IATA Travel Pass will be available on Apple Store in mid-April UBS upgrades Apple to buy on auto market hopes UBS upgrades Apple to buy on auto market hopes Ming-Chi Kuo reveals that Apple&quot;s next iPhone Cameras will include a 7P Lens from Sunny Optical Should Franklin LibertyQ U.S. Equity ETF (FLQL) Be on Your Investing Radar? IATA says travel pass app to launch on Apple mid-April J.Safra Asset Management Corp Acquires New Holdings in Apple Inc. (NASDAQ:AAPL) Apple Inc. (NASDAQ:AAPL) Shares Purchased by Matrix Asset Advisors Inc. NY Janus Henderson Group PLC Takes Position in Apple Hospitality REIT, Inc. (NYSE:APLE) Apple backs start-up aiming to disrupt music labels Apple is reportedly fixing a bug that blocked searches for &quot;Asian&quot; as &quot;adult&quot; content Phone-maker Xiaomi is investing $10 billion in a new electric vehicle unit as Apple and Huawei stay silent on their EV plans A new study shows that every 12 hours, Google&quot;s Android collects 20X  more data on its users than Apple&quot;s iOS Apple Stock Still Has Catalysts To Retain &quot;Most Valuable&quot; Title Korea&quot;s Fair Trade Commission has referred Apple to Prosecution for Hampering with its Probe into the company&quot;s Unfair Practices Snapchat Parent To Launch AR Glasses And A Drone, Furthering Hardware Push: Report Apple &quot;Betrayed&quot; My Trust, Says iPhone User Who Lost $1M To Scam Bitcoin App Is Samsung&quot;s LoopPay an answer to Apple Pay? Apple Maps will now display Covid-19 airport SOPs on your iPhone, iPad, and Mac Apple Watch axes health tracking function Is Apple building a self-driving car? Did Apple&quot;s design chief play a role in the new lightsaber? Apple---s Irish employees raise ---2m for charities Skeletons In The Closet Haunt Volkswagen As PR Stunt To Highlight EV Foray Backfires"
2021-04-01,"Apple&quot;s Tim Cook Says Voting &quot;Ought To Be Easier Than Ever&quot; How to transfer photos from your iPhone to a Mac or PC Apple&quot;s Tim Cook Latest To Condemn Georgia Voting Law SingularDTV (SNGLS) Price Tops $0.0356 Infrastructure Week Winners New Autonomous Driving Tech Could Steer Microvision Toward Another Crash Meet the winner of Apple 3.0&quot;s 2021 price target contest Former Parler CEO John Matze launched a GoFundMe page to crowdfund his legal fees Apple&quot;s Tim Cook joins chorus in denouncing Georgia&quot;s voting law A guide to network security keys, the password for your Wi-Fi network Netflix Buys the Rights to a Pair of &quot;Knives Out&quot; Sequels for $450 Million Apple reveals more about Mixed Reality Headset GUI&quot;s, how to control menus with Eye Tracking & in-air Micro Gesturing Two Words Scream, ""Avoid Castor Maritime Stock"" Google, Facebook, Amazon, Apple and Microsoft. Call Them Tech Frenemies for Life. The patent behind the USB-C Charging Port built into the Hinge of Apple&quot;s Smart Keyboard has come to light One Apple platform in 2021: The year iPad and Mac begin to converge Apple CEO, major companies condemn new Georgia voting law Hemisphere Media Acquires Video-on-Demand Service Pantaya For $124M All Tech Revolves Around This Disruptor TNB Financial Buys Intel Corp, Gilead Sciences Inc, Expedia Group Inc, Sells Apple Inc, Palo ... Arizona app store bill fails after heavy lobbying from Google and Apple 10 Information Technology Stocks Showing Unusual Options Activity In Today&quot;s Session A Look at What&quot;s Going on With RH, KB Home, and Rite Aid Chip-Gear Stocks Surge On Taiwan Semiconductor Spending Plans Apple (NASDAQ:AAPL) Stock Rating Reaffirmed by The Goldman Sachs Group Practice Patience With Hedosophia Holdings Corp. V UK Antitrust Watchdog Launches Probe On Facebook&quot;s $400M Giphy Acquisition: Report Apple Is Building a Massive Battery Storage Project Using Tesla Megapack Batteries S&amp;P 500 hits 4,000 mark on tech strength, reopening optimism Apple removes Siri&quot;s female voice as its default and adds two new voices 7 Tech Stocks Becoming Healthcare Stocks Apple (AAPL) Leads $50M Investment Round for UnitedMasters Lion? Lamb? March&quot;s best stocks, strategies into April Top Ranked Value Stocks to Buy for April 1st Top Ranked Momentum Stocks to Buy for April 1st TSMC plans to spend $100 billion on advanced chips amid shortage Top Ranked Income Stocks to Buy for April 1st Apple will use Tesla Megapack batteries at its solar farm facility Top Ranked Growth Stocks to Buy for April 1st Thinking about trading options or stock in Beam Global, Apple, Workhorse Group, Nio, or AbCellera Biologics? Apple&quot;s Magic Keyboard for the iPad is $100 off at several retailers again Is Now The Time To Buy Stock Or Options In Microsoft, Carnival, Nio Or Tesla? 3 Top Cloud Computing Stocks to Buy Right Now InterDigital (IDCC) Joins TSDI &amp; BIF for Wireless Growth in India Apple Inc. (NASDAQ:AAPL) is Grand Jean Capital Management Inc.&quot;s 7th Largest Position Inscription Capital LLC Has $12.94 Million Stock Holdings in Apple Inc. (NASDAQ:AAPL) Apple Inc. (NASDAQ:AAPL) Shares Sold by Psagot Investment House Ltd. Stock Market News for Apr 1, 2021 What&quot;s Up With Apple: New Siri Voices, Tesla Batteries and More Apple reveals future smart ring designs like a multi-ring system & rings that work with Apple Watch to control on-screen content 5 Weirdest Corporate April&quot;s Fool Pranks Of All Time: Voltswagen, Tesla Model W And More Apple forced to offer Russian iPhone users local apps at setup thanks to new law More than 70 top Black business leaders are reportedly urging US companies to fight against Republican voting laws Russian &quot;Anti-Apple&quot; Law Requiring Local Apps Takes Effect Wall Street Breakfast: Eyes On A Rare Payrolls Day Zacks Earnings Trends Highlights: Exxon, Chevron, Ford, Apple and JPMorgan Tim Cook condemned Georgia&quot;s new election law, saying voting &quot;ought to be easier than ever&quot; Russian &quot;anti-Apple&quot; law requiring local apps takes effect Taiwan chip maker TSMC to invest $100B to grow capacity Matisse Capital Boosts Stock Holdings in Apple Inc. (NASDAQ:AAPL) Providence Wealth Advisors LLC Has $6.25 Million Holdings in Apple Inc. (NASDAQ:AAPL) Apple Invents an Advanced Ring System with Four Types of Functionality covering Cursor movement, Paint, Pencil & Trackpad Modes Apple is using Tesla batteries to build a new energy storage facility for its giant solar farm in California Goldman&quot;s Rod Hall is still telling clients to sell Apple New Strong Buy Stocks for April 1st ViacomCBS Stock&quot;s Best Hope Is Buyout After Archegos Knock-Down German American Bancorp Inc. Grows Stock Position in Apple Inc. (NASDAQ:AAPL) Russia now requires all smartphones and devices in the country to be pre-installed with the country&quot;s software Here are my top 5 stocks as we start Q2 Miley Cyrus Is Doing A $1M Giveaway For Cash App Users To Own Their Favorite Stock Siri on iPhone and iPad to no longer have female voice by default, Apple to also introduce two new voices Russian law requires smart devices to come pre-installed with domestic software This iPhone app lets anybody mint an NFT for anything-for free Android, iOS beam telemetry to Google, Apple even when you tell them not to - study Cramer Says Forget Tech And Look To These Sectors In Q2 Apple - Highlighting Commitment To &quot;Diversity&quot; - Says Siri Will No Longer Default To Female Voice Apple Will Use Tesla Battery &quot;Megapacks&quot; At The California Solar Storage Site: Report : Apple to use Tesla battery packs for solar-energy storage facility: report Stocks edge up as Biden spending plan boosts US outlook Apple unveils new watch, distribution deal Apple to build &quot;grid scale&quot; solar energy storage project in California Will Apple Watch revolutionize the smartwatch market? Apple iOS 14.5 Beta Update: Battery Recalibration for Bug Fix; Is It Ideal to Upgrade? Microsoft Tightening Tentacles Around Pentagon With $22B AR Headset Deal, Says Analyst Apple CEO unveils the new Apple Watch Apple will use Tesla&quot;s &quot;megapack&quot; batteries at its California solar farm Apple&quot;s ""Spring Forward"" event: Three things to watch Apple&#039;s developer conference goes online again, student challenge returns Will Apple Watch catch on? Apple TV tvOS 14.5 Beta Code Reveals New Universal Remote; Center Wheel Revealed For Apple TV Remote Apple Watch to be unveiled 2 Big Growth Stocks to Buy on the Dip for Q2 and Beyond This Million-Dollar Canadian Stock Could Build the Future Apple Car"
2021-04-02,"Apple Knew It Was Selling Defective MacBook Displays, Judge Concludes Apple rejects apps breaking new privacy rules, hinting iOS 14.5&quot;s release is near Apple begins rejecting apps that use advertising SDKs for fingerprinting users Bluetooth speakers vs. smart speakers - the differences, pros and cons, explained Google&quot;s new sleep-sensing Nest Hub is a great bedside companion, but it can&quot;t replace a wearable sleep tracker The Emoji Story: You should never have this much fun learning about Unicode Tim Cook marks Apple&quot;s 45th with a tweet Analysts Expect Apple Inc. (NASDAQ:AAPL) Will Announce Quarterly Sales of $77.39 Billion 7 Robinhood Stocks Even Billionaires Want in Their Portfolios Better Buy: Lumentum vs. Infinera App Store Now Rejecting Apps Using Third-Party SDKs That Collect User Data Without Consent New Investor? Here Are 3 Great Starter Stocks Nomad&quot;s Base Station Pro wireless charger is half price this weekend Alcosta Capital Management Inc. Acquires New Position in Apple Inc. (NASDAQ:AAPL) Apple And Microsoft: An In-Depth Comparison Across 17 Categories Apple knowingly sold defective MacBook displays, rules judge Apple Arcade just got a huge update of new games, including some mobile classics Forget Tesla! Magna Is a Better EV Stock Amid Apple Car Rumours Apple Arcade Launches its Biggest Expansion Yet, Growing its Award-Winning Catalog to More Than 180 Games $1 Dogecoin Increasingly Unlikely, but $10 Is Absolutely Impossible Gyon Technologies Capital Management LP Grows Stock Position in Apple Inc. (NASDAQ:AAPL) Barr E S & Co. Has $29.04 Million Stock Holdings in Apple Inc. (NASDAQ:AAPL) Apple&quot;s Retail Team has designed a unique Demonstration Device allowing Sales Reps to make Presentations to remote users Principle Wealth Partners LLC Increases Stake in Apple Inc. (NASDAQ:AAPL) Nano Dimension Is Making 3D Printing Great Again 2 Top Stocks You Can Buy and Hold for the Next Decade Apple turns 45: Tim Cook remembers Steve Jobs, asks employees to rededicate themselves to creating transformative products Thinking About Buying AMC and GameStop? These 2 Robinhood Stocks Are Much Better Picks Microsoft Avoided the Tech Wreck and Could Best Apple&quot;s Market Cap Soon 10 things in tech you need to know today Episode 262: In praise of climate lobbying, renewable aggregation deals iOS 14.5: Apple&quot;s latest beta update fixes battery calibration bug on iPhone 11 series Final Fantasy creator&quot;s latest game, Fantasian,  launches on Apple Arcade Tesla Has Its Fingerprints On Apple & Volkswagen Business Deals Apple iOS 14.5 Blocks Fingerprint Tracker Apps that Create Unknown Profile Apple knew it was selling defective MacBook displays, judge concludes"
2021-04-03,"Fake App On Apple&quot;s App Store Scams User Out of 17.1 Bitcoins ($600,000) This Week In Techdirt History: March 28th - April 3rd Amazon says it supports expanding voting rights but it gave $500,000 to lawmakers who oppose those efforts Snapchat reportedly made plans to skirt Apple&quot;s new privacy rules and keep tracking its user base Benzinga&quot;s Bulls And Bears Of The Week: Apple, GM, JetBlue, Lululemon, Tesla And More Benzinga&quot;s Bulls And Bears Of The Week: Apple, GM, JetBlue, Lululemon, Tesla And More A startup fever is sweeping Silicon Valley 4 changes you could see when you return to the office, from hot desks to more relaxed dress codes MiB: Shirl Penney, Dynasty Financial Partners These tech deals contain zero April Fool-ery Apple and its frenemies Apple Inc. (NASDAQ:AAPL) Shares Sold by Capstone Financial Advisors Inc. Vancity Investment Management Ltd Takes $42.89 Million Position in Apple Inc. (NASDAQ:AAPL) Laidlaw Wealth Management LLC Increases Stock Holdings in Apple Inc. (NASDAQ:AAPL) 33,773 Shares in Apple Inc. (NASDAQ:AAPL) Purchased by Sax Wealth Advisors LLC Africa in the news: Africa-Spain relations, technology opportunities in Kenya and South Africa, and attacks in Mozambique Alpha DNA Investment Management LLC Invests $1.26 Million in Apple Inc. (NASDAQ:AAPL) Kara Swisher did Tim Apple on April Fool&quot;s Day Good news for Saudi Apple device owners as repair program expanded Apple (NASDAQ:AAPL) Raised to Buy at UBS Group Apple Sells Defective Macbook Displays, Cause of &quot;Stage-Light&quot; Effect Exposed Hon Hai, Apple&quot;s biggest iPhone assembler, is eyeing cars"
