ate,Headlines
2021-02-12,"Facebook is building a smartwatch and wants to sell it to you starting next year in exchange for your health data Nvidia wants to buy CPU designer Arm-Qualcomm is not happy about it Company Close Updates: Apple Inc. stock rises Friday, still underperforms market Facebook working on smartwatch for next year - report PayPal&quot;s Operational Metrics Help Drive a Record Year Investing with Thematic ETFs in 2021 Why Morgan Stanley Is Bullish on QuantumScape, Fisker, Bearish On Lordstown, Romeo Power Apple Will Proxy Safe Browsing Traffic on iOS 14.5 To Hide User IPs from Google Apple will proxy Safe Browsing traffic on iOS 14.5 to hide user IPs from Google 5G Streaming Screen Synch Stinks Apple Patent reveals that they could be working on a Breathalyzer-Like Feature for a Future iPhone or Apple Watch The Story of GameStop Stock Should mobile gamers consider upgrading to iPhone 12? Google, Microsoft, Qualcomm Protest Nvidia&quot;s Arm Acquisition Best Buy&quot;s Presidents&quot; Day sale features big discounts on the Apple Watch and Vizio 4K TVs Apple launches an augmented reality app to promote For All Mankind on Apple TV Plus 10 Information Technology Stocks Showing Unusual Options Activity In Today&quot;s Session Amazon Shows A Strong Competitive Advantage Viral TikTok claims you can be seen on Zoom even with your mic and camera off - but you can&quot;t Apple (AAPL) Upgraded to Strong Buy: Here&quot;s What You Should Know Mirrored Apple (mAAPL) Price Tops $144.07 Billionaires Who Profited Most During The Pandemic: An Analysis GME, AMC and DOGE: Stop Worrying and Love the Bubble Should you invest in Apple, Tilray, General Electric, Bank of America, or Twitter? Wall St dips, still headed for second straight weekly rise Vergecast: Google&quot;s mysterious lack of app updates and Apple&quot;s rumored VR headset Bloomberg Revisits their 2018 Story titled &quot;The Big Hack&quot; in an updated report titled &quot;The Long Hack: How China Exploited a U.S. Tech Supplier&quot; Apple&quot;s Market Cap Lingers at $2.3 Trillion Disney (DIS) Beats on Q1 Earnings, Coronavirus Hurts Top-Line Growth GMF: China And Taiwan Markets Are Booming Apple Releases &quot;For All Mankind: Time Capsule&quot; Augmented Reality for iPhone and iPad Apple/Nissan: check your privilege Neil Cybart: More than 1/3 of U.S. iPhone owners wear an Apple Watch Dump your Apple Mac and get a PC (says Intel) Snag a set of Beats Flex at Amazon for $40, the lowest price yet The US jobs market is a mess. It won&quot;t heal unless the government stays out of the way of people building new businesses. Next DraftKings? Here&quot;s Why This Fast-Growing TSX Stock Is a Buy Top 5 Best Fitness Trackers of 2021: Apple Watch, Garmin, Fitbit, and MORE! These 2 Enterprise Stocks Will Be Winners The Long Hack: How China Exploited a U.S. Tech Supplier With This Much Cash, Maybe It&quot;s Time to Goose the Apple Stock Dividend Apple Watch surpassed the 100 million mark Worldwide in 2020 with 35% of iPhone users in the U.S. owning one What&quot;s Up With Apple: 100 Million Watch Wearers, $13 Billion in Subscriptions, Intel Takes on Mac Buy This Top 5G Stock in February Developer Spotlight: WaterMinder Apple Inc. (NASDAQ:AAPL) is Stratos Wealth Advisors LLC&quot;s 2nd Largest Position iPhones and pacemakers: A friend of the blog weighs in Pundi X (NPXS) sets for testnet launch gains 102% CEOs are joking about GameStop, worrying it signals a bubble, and preparing for the next meme-stock boom Emerald Mutual Fund Advisers Trust Increases Position in Apple Inc. (NASDAQ:AAPL) Piper Sandler: Apple&quot;s opt-in for tracking mostly priced-in for Facebook stock Microsoft Yearns US To Charge Google, Facebook For Content Usage: WSJ Stock Valuation Metrics 101 Crypto Investors Should Wait for Stellar Lumens to Pull Back UK shares to watch: 5 on my list Is iShares MSCI ACWI Low Carbon Target ETF (CRBN) a Strong ETF Right Now? ETW: Fund With A Global Tilt, Yielding 9% Apple Inc. (NASDAQ:AAPL) is First Heartland Consultants Inc.&quot;s 8th Largest Position Apple Inc. (NASDAQ:AAPL) Shares Bought by Cypress Capital Management LLC WY Falcon Point Capital LLC Invests $232,000 in Apple Inc. (NASDAQ:AAPL) 3 Investments That Are Better Than Bitcoin Apple Inc. (NASDAQ:AAPL) Stake Decreased by Colonial Trust Advisors Zurcher Kantonalbank Zurich Cantonalbank Acquires 3,041 Shares of Apple Hospitality REIT, Inc. (NYSE:APLE) Apple Has &quot;No Excuse&quot; To Be Trailing In SVOD Space, Netflix Co-Founder Says While Praising Disney Study: Smartwatches predict COVID-19 Episode 255: Reflections and highlights from GreenBiz 21 Galaxy Tab S8 Enterprise Edition: Potential iPad Pro Rival Appears on Samsung&quot;s Website Apple iOS 14.5 will hide Safari users&quot; IP addresses from Google&quot;s Safe Browsing Apple adds 20 new ""System"" Patent Claims to further Protect their VR Headset&quot;s &quot;Tunable Lens&quot; System Buy Garmin Stock at Highs Before Earnings as Long-Term Tech Play?"
2021-02-13,"Steve Ballmer said on Clubhouse that he wishes Microsoft had taken on Amazon&quot;s cloud business sooner Facebook v Apple: the looming showdown over data tracking and privacy The best Presidents&quot; Day tech deals we can find this weekend Does Bezos&quot; Move Make Sense? As Apple&quot;s App Tracking Transparency feature is closer to going live, Facebook has told his inner circle that they must &quot;Inflict Pain&quot; on Apple Mark Zuckerberg reportedly told Facebook staff &quot;we need to inflict pain&quot; on Apple, in response to criticism over data collection practices This Growth Stock Is a Terrific Bargain Right Now MiB: Ben Inker, GMO Tesla Just Bought $1.5 Billion Worth of Bitcoin. Is Apple Next? 3 Cheap Stocks to Buy in February &quot;Nobody&quot;s going to listen to Buffett&quot;: Chamath Palihapitiya called himself the figurehead of the Reddit-trader era in a recent interview. Here are his 10 best quotes. Mirrored Apple Price Down 5.1% This Week (mAAPL) Apple Starts To Reopen Retail Stores Is Corning Incorporated Stock a Buy? Is Apple Stock a Buy? Twitter takes Apple&quot;s side Alliance Wealth Management Group Trims Position in Apple Inc. (NASDAQ:AAPL) Salzhauer Michael Purchases 130 Shares of Apple Inc. (NASDAQ:AAPL) Facebook maybe working on its own Apple Watch-rival Android smartwatch 10 Weekend Reads Bitcoin (BTC) payments card BitPay now supports Apple Pay Zuck on Cook: &quot;We need to inflict pain&quot; Nicholas Ward&quot;s Dividend Growth Portfolio: January 2021 Review HighTower Trust Services LTA Reduces Stake in Apple Inc. (NASDAQ:AAPL) Garner Asset Management Corp Grows Stock Position in Apple Inc. (NASDAQ:AAPL) Warren Buffett&quot;s Berkshire Hathaway has quietly racked up a $6 billion gain on its GM and BYD bets Apple Pay users can now buy products with bitcoin using BitPay&quot;s Prepaid Mastercard Waypoint Wealth Partners Inc. Purchases Shares of 16,774 Apple Inc. (NASDAQ:AAPL) Head to Head Review: On Track Innovations (OTCMKTS:OTIVF) versus The Peck (NASDAQ:PECK) Can&quot;t charge MacBook Pro beyond 1pc? Apple is offering free battery replacements for select models Facebook Meets Apple in Clash of the Tech Titans---&quot;We Need to Inflict Pain&quot; S&amp;P 500 hits record peak as stocks post weekly gain Report: Facebook Developing Android-Based Smartwatch"
2021-02-14,"Big Tech&quot;s Unlikely Next Battleground: North Dakota Volkswagen Chief Says Company &quot;Not Afraid&quot; Of Apple Electric Car SMH: Semiconductors Could Be Next Buying Frenzy Amid &quot;Supply Squeeze&quot; Apple v. Pear: Not Tim Cook&quot;s finest hour Is BlackBerry Back? With New Partnerships, The Company Is Ready For A Closer Look Tracking Wallace Weitz&quot;s Weitz Investment Management Portfolio - Q4 2020 Update 4 Vanguard ETFs That Could Make You a Millionaire Volkswagen CEO Diess &quot;not afraid&quot; of an Apple electric car As Rumors persist that iPhones will launch this year with Face and Touch ID, Apple updates their dual Biometrics Patent Mark Zuckerberg Told Facebook Staff In 2018 To &quot;Inflict Pain&quot; On Apple: Report This week&quot;s Apple trading strategies (2/15-2/19) I just spent an hour with Apple&quot;s support team and now I need a drink Lions Gate: Winning The Streaming Game Week 7 MDA Breakout Stocks - February 2021: Short-Term Picks To Give You An Edge A Huge Fund Bought Tesla, Apple, and Microsoft Stock. Here&quot;s What It Sold. Apple Inc. (NASDAQ:AAPL) Shares Sold by Opes Wealth Management LLC Bender Robert & Associates Has $63.81 Million Stock Holdings in Apple Inc. (NASDAQ:AAPL) Apple: Sizing Up iPhone Sales With The Help Of Skyworks, Qorvo And Cirrus Logic Apple Inc. (NASDAQ:AAPL) Shares Purchased by WT Wealth Management Apple Inc. (NASDAQ:AAPL) Holdings Increased by Bernardo Wealth Planning LLC Apple Inc. (NASDAQ:AAPL) Shares Sold by Franklin Street Advisors Inc. NC McCarthy Asset Management Inc. Makes New $6.85 Million Investment in Apple Inc. (NASDAQ:AAPL) &quot;We Need to Inflict Pain&quot;:  Mark Zuckerberg&quot;s War on Apple"
2021-02-15,"Wedbush: Apple is playing the Apple Car dating game If your Apple Watch still won&quot;t charge after the latest update, Apple will fix it for free Bitcoin&quot;s credibility boost Parler back online after getting boot from Amazon over riot Parler back online after getting boot from Amazon over riot Parler back online after getting boot from Amazon over riot The Best Way to Make $1 Million During the 2021 Stock Market Rally Travel curbs help Apple India post highest sales growth in December quarter Zuckerberg responds to Apple&quot;s privacy policies: ""We need to inflict pain"" After the failure of the Facebook Phone, get ready for a Facebook Watch Parler, a preferred social-media platform for the far-right, is back online with Mark Meckler as CEO Hyundai Says No To Apple As KIA Says Yes To Electric Cars Is Apple (AAPL) Stock Outpacing Its Computer and Technology Peers This Year? TSMC Could Soon Make Apple&quot;s AR Dreams a Reality Nissan Says &quot;Not in Talks with Apple&quot; Over Autonomous Car Project 3 Reasons Why LiveRamp Is a Cheap SaaS Stock Tinder, the dating app, to sell phone cases, accessories and apparel under its &quot;Tinder Made&quot; brand Nissan confirms it is not in talks with Apple Inc. over autonomous car project Bitcoin Is My Largest Holding And I&quot;m Not Selling A Dime The Largest US Companies By Revenue During The Last 12 Presidential Administrations May Surprise You Another Wild Rumor Shot Down as Nissan denies all rumors of working with Apple as a Vehicle Partner, Period A global chip shortage is wreaking havoc on everything from cars to game consoles. Here are the industries most affected by the ongoing scarcity. Tata&quot;s Land Rover plans six all-electric models by 2026 and prototype hydrogen fuel cell car Jaguar Land Rover unveils all-electric plans and prototype hydrogen fuel cell car ByteDance to walk away from TikTok-Oracle-Walmart deal Yet another industry boasts: &quot;We are not afraid&quot; of Apple MGG 857: Avoiding the Duck iOS 14.5 Best Jailbreak Tools: These New Features Make This iOS the Most Aweseome iPhone Update Spotify May Have Already Won Podcasting These 4 Dividend ETFs Are a Retiree&quot;s Best Friend Tata&quot;s Land Rover unveils plans for six all-electric models by 2026 Apple Car Is Just Around Corner, Says VW CEO New CEO&quot;s AWS Leadership Record Provides Rationale for Amazon Stock Buy Sterling Manor Financial LLC Acquires New Holdings in Apple Inc. (NASDAQ:AAPL) Campbell Newman Asset Management Inc. Has $66.29 Million Holdings in Apple Inc. (NASDAQ:AAPL) Kanawha Capital Management LLC Decreases Stock Position in Apple Inc. (NASDAQ:AAPL) Apple Inc. (NASDAQ:AAPL) Shares Acquired by Institute for Wealth Management LLC. The long, bumpy road to the Apple Car The long, bumpy road to the Apple Car Warren Buffett Made 3 Big Mistakes Recently -- Here&quot;s the Reason They Haven&quot;t Hurt Him Apple reportedly approached Nissan about making an autonomous car together, but the talks collapsed after they clashed over branding Apple iPhone 13 rumored to include portrait mode video and always-on display Leading shareholders tighten grip on MitchellsButlers 10 things in tech you need to know today Apple&quot;s 2021 iPhone 13 is rumored to shoot for the stars : Nissan says it&quot;s not in talks to make Apple&quot;s autonomous car: report Nissan says it&quot;s not in Apple car discussions Apple held talks with Nissan on autonomous car that have since ended Nissan says &quot;not in talks with Apple&quot; over autonomous car project Next Apple iPhone Could Have a Screen that Never Turns Off: Battery-Efficient Phones of 2021 Rumors Apple approached Nissan to work on autonomous car project"
2021-02-16,"North Dakota&quot;s Senate voted against a Bill that would have been Damaging to Apple&quot;s App Store Warren Buffett cuts stake in Wells Fargo, trims Apple holdings and adds new stake in Chevron Stock Markets Finish Mixed as Warren Buffett Makes 2 Big Buys Apple&quot;s adjusting emoji in iOS 14.5 to promote helmet use and sell headphones Why Wedbush Expects Apple To Find An EV Partner In 2021 Dark mode can save battery, but only if your device has an OLED screen - here&quot;s what you should know Nissan Exec Addresses Talks With Apple Apple won&quot;t have to allow App Store alternatives on iOS after North Dakota bill fails 4 ETFs to Invest in Shining Semiconductor Stocks 3 Soaring, Growth Tech Stocks to Buy Before Earnings Buffett&quot;s Berkshire Hathaway trims its stake in Apple, but adds to drug holdings : Berkshire Hathaway ups drug-stock stakes while trimming Apple Warren Buffett&quot;s Berkshire Hathaway reveals billion-dollar stakes in Chevron and Verizon Company Close Updates: Apple Inc. stock falls Tuesday, underperforms market Warren Buffett&quot;s Berkshire pares Apple stake, exits JPMorgan, Barrick Gold, adds Verizon Techdirt Podcast Episode 270: Regulating The Internet Won&quot;t Fix A Broken Government The 7 best smart speakers of 2021 Apple wins victory as North Dakota votes down bill that would regulate app stores Shortened Presidents&quot; Day Week - The Market 411 Twitter Showed It Is Bigger Than Any Account- But How Far Can Its Tweets Go? Shopify (TSX:SHOP) Stock Will Make More Millionaires in 2021 Today&quot;s best tech deals: Hitman 3, 400GB microSD cards, and more North Dakota lawmakers jump into Apple/Epic fight with new app store bill Is Now a Good Time to Buy Naked Brand Stock? Apple Could Launch Foldable Phone With Apple Pen In 2023: Report Apple&quot;s Foldable iPhone to Have Stylus Support: Will Apple Pencil be Compatible? Apple won 77 Patents today covering a Next-Gen iPad and/or iPhone with a Backside Display & New Touch Bar Configurations Mirrored Apple Price Reaches $141.95 on Exchanges (mAAPL) Apple could soar 66% in bull-case scenario as it searches for a &quot;golden&quot; partnership to build electric vehicles, Wedbush says 10 Information Technology Stocks Showing Unusual Options Activity In Today&quot;s Session Microsoft&quot;s unified Office app is now available for iPad Buffett&quot;s firm reveals new investments in Verizon, Chevron The 6 best running watches we tested in 2021 Sectorfocus Blog: Apple iCar Speculation Continues. Tech and Auto Analysts See the Car Differently. Socket Mobile Launches Enterprise-Grade Scanners For iPhone 12 series, Shares Skyrocket SPY, AAPL, MSFT, AMZN: Large Inflows Detected at ETF Could Bitcoin Hit $100,000 This Year? SCKT Stock: What to Know About Socket Mobile as Shares Rocket Today BB Stock Down From Reddit-Fueled Highs But Still a Strong Buy Analyzing Apple&quot;s Unusual Options Activity Thinking about trading options or stock in Apple, Exxon Mobil, Tesla, Square, or Wells Fargo? 3 Reasons Cloudflare Stock Should Be on Your Radar in 2021 and Beyond Warren Buffett&quot;s Berkshire Hathaway scores $1.4 billion gain on 5 Japanese stocks in under 6 months Apple is offering free repairs for Watch Series 5, Apple Watch SE users facing this issue 9 Safe Stocks for Your 401k Nextech AR beefs up sales team with two top-tier executive hires from Fastly and Salesforce.com Priyanka Chopra Jonas on overcoming insecurities, dealing with loss, and her best career advice Parler Back Online With SkySilk&quot;s Web Hosting SocketMobile&quot;s stock rockets on heavy volume after unveiling DuraSled scanner for iPhone 12s How Apple Pay Helps &quot;Cheat&quot; Banks Out Of $250 Billion In Payments Sony Trades At A Discount To Sum Of The Parts With Free Catalysts BC Vault Equips its Hardware Crypto Wallets with In-App Purchasing Option Can a cardboard box run Doom II? Yes Supply-chain attack that fooled Apple and Microsoft is attracting copycats Watch this space: Apple offers free repairs for the self-bricking Apple Watch SE and Series 5 wearables High Note Wealth LLC Acquires New Shares in Apple Inc. (NASDAQ:AAPL) Apple patches severe macOS Big Sur data loss bug Wall Street Breakfast: Cold Snap Is Tesla&quot;s Bitcoin Investment a Good Move? Facebook&quot;s Health and Wellness Smartwatch To Be Released to Match Apple Watch! Apple wins a Patent for Displays with Multiple Refresh Rate Modes Ranging from 60-120Hz and Much Higher Cathie Wood&quot;s ARK Invest now holds more than 7 million shares in the Grayscale Bitcoin Trust Hartford Investment Management Co. Buys 179,137 Shares of Apple Inc. (NASDAQ:AAPL) Apple Inc. (NASDAQ:AAPL) Position Lessened by Abacus Planning Group Inc. Apple Inc. (NASDAQ:AAPL) is Osborne Partners Capital Management LLC&quot;s 2nd Largest Position Parler comes back online after a month off the internet Apple will fix your Apple Watch for free if you run into this charging problem Microsoft is reportedly testing a new browser-based streaming service that would let you play Xbox games on your PC and iPhone Hanson & Doremus Investment Management Buys 846 Shares of Apple Inc. (NASDAQ:AAPL) Apple Inc. (NASDAQ:AAPL) Shares Sold by Atlantic Union Bankshares Corp Hartford Investment Management Co. Purchases 179,137 Shares of Apple Inc. (NASDAQ:AAPL) Hanson & Doremus Investment Management Increases Holdings in Apple Inc. (NASDAQ:AAPL) Apple Inc. (NASDAQ:AAPL) is Osborne Partners Capital Management LLC&quot;s 2nd Largest Position Parler claims it&quot;s relaunching this week Why Apple Getting Increasingly Serious About Making Cars? &quot;Transportation&quot; Dwarfs &quot;Smartphone&quot; Market, Says Munster Why Apple Getting Increasingly Serious About Making Cars? &quot;Transportation&quot; Dwarfs &quot;Smartphone&quot; Market, Says Munster Sanchez Wealth Management Group Raises Stock Position in Apple Inc. (NASDAQ:AAPL) High Note Wealth LLC Invests $9.30 Million in Apple Inc. (NASDAQ:AAPL) 10 things in tech you need to know today Why Does the Apple TV Still Exist? Nissan Denies Collaboration with Apple on Autonomous Car Project Apple Talked EV Tie-Up With Nissan But Concerns Over Automaker Becoming &quot;Foxconn&quot; Came In The Way: FT Further reading REVIEW  With iPhone 12 Mini, Apple made small phones great again Volkswagen CEO Says He&quot;s Not Scared of Apple How purpose-driven transformations help banks recover Sell Apple And Buy Alphabet Lookback: Why Valuation Matters Apple Watch Power Reserve Mode Issue Free Repair: How to Avail? Facebook vs. Apple &quot;Secret War:&quot; Zuckerberg Wishes to &quot;Inflict Pain&quot; on Rival, Reveal Employees Apple Car or Alphabet&quot;s Waymo? This 1 Stock Is Future Foxconn of Automotive"
